{
  "schema_version": "ws-1",
  "query_frame": {"frame": "unknown", "basis": null},
  "temporal_order": {"status": "unknown", "order": null, "basis": null},
  "cameras": [
    {"id": "cam1", "image_id": "image_1"},
    {"id": "cam2", "image_id": "image_2"}
  ],
  "entities": [
    {"id": "e1", "type": "object", "label": "chair in image 1", "cross_view": null},
    {"id": "e2", "type": "object", "label": "chair in image 2", "cross_view": null}
  ],
  "observations": [
    {"id": "o1", "entity": "e1", "image_id": "image_1", "where": "left", "description": "wooden chair"},
    {"id": "o2", "entity": "e2", "image_id": "image_2", "where": "right", "description": "similar wooden chair"}
  ],
  "identity_links": [
    {"id": "i1", "entities": ["e1", "e2"], "status": "tentative", "uncertainty": "high"}
  ],
  "claims": [],
  "unknowns": ["whether the two chairs are the same object"]
}
