{
  "schema_version": "ws-1",
  "query_frame": {"frame": "unknown", "basis": null},
  "temporal_order": {"status": "unknown", "order": null, "basis": null},
  "cameras": [
    {"id": "cam1", "image_id": "image_1"},
    {"id": "cam2", "image_id": "image_2"}
  ],
  "entities": [],
  "observations": [],
  "identity_links": [],
  "claims": [],
  "unknowns": ["no entities or relations could be established"]
}
